[
  {
    "id": "topic-memory",
    "courseId": "course-psych-101",
    "name": "Memory Systems",
    "masteryLevel": 0.42
  },
  {
    "id": "topic-conditioning",
    "courseId": "course-psych-101",
    "name": "Conditioning",
    "masteryLevel": 0.61
  },
  {
    "id": "topic-cell-biology",
    "courseId": "course-bio-220",
    "name": "Cell Biology",
    "masteryLevel": 0.48
  }
]
